[
  {
    "id": "HIG-TECHNOLOGIES-SHAZAMKIT-0001",
    "title": "Let people opt in to storing your app’s recognized songs to their iCloud library",
    "category": "technologies",
    "topic": "shazamkit",
    "subtopic": "best-practices",
    "statement": {
      "en": "Preserve people’s ability to opt in to storing your app’s recognized songs to their iCloud library.",
      "ja": "利用者がopt in to storing your app’s recognized songs to their iCloud libraryできる状態を保つ。"
    },
    "normative_level": "SHOULD",
    "confidence": "low",
    "review_required": true,
    "polarity": "recommend",
    "severity": "warning",
    "scope": {
      "portability": "technology-specific",
      "platforms": [
        "ios",
        "ipados",
        "macos",
        "tvos",
        "visionos",
        "watchos"
      ],
      "devices": [
        "iphone",
        "ipad",
        "mac",
        "apple-tv",
        "apple-vision-pro",
        "apple-watch"
      ],
      "components": [],
      "modalities": []
    },
    "conditions": [
      "Apply within the platform, component, and section context identified by the source trace."
    ],
    "exceptions": [],
    "rationale": {
      "en": "Applying this guidance supports a consistent and usable ShazamKit experience on the scoped Apple platforms.",
      "ja": "この指針は、対象AppleプラットフォームにおけるShazamKitの一貫性と使いやすさを支えます。"
    },
    "checks": {
      "automated": [],
      "manual": [
        "Does the design satisfy “Preserve people’s ability to opt in to storing your app’s recognized songs to their iCloud library.” in the documented ShazamKit context?"
      ]
    },
    "testability": "manual",
    "anti_patterns": [
      "Ignoring this guidance in a context where the source section applies."
    ],
    "positive_examples": [
      "A design review records how the implementation satisfies this rule and any source-scoped exception."
    ],
    "source": {
      "url": "https://developer.apple.com/design/human-interface-guidelines/shazamkit",
      "page_title": "ShazamKit",
      "section_path": [
        "ShazamKit",
        "Best practices"
      ],
      "retrieved_at": "2026-07-21T07:08:10.891Z",
      "source_hash": "3e65d0384fa0b63afbf49a86c23fffddefd300115ffdda803712710b084ec427",
      "source_sentence_hash": "2fe27fd694d359f1ed93f80759f08d46ce10e7a2630eb112c2f4015e275447e7",
      "evidence_paraphrase": "Preserve people’s ability to opt in to storing your app’s recognized songs to their iCloud library."
    },
    "tags": [
      "technologies",
      "shazamkit",
      "best-practices"
    ],
    "priority_rank": 6,
    "status": "active",
    "apple_native_rule": "Preserve people’s ability to opt in to storing your app’s recognized songs to their iCloud library.",
    "portable_interpretation": "Preserve the user-centered intent after replacing Apple-specific platforms, components, and input conventions."
  }
]
