[
  {
    "id": "HIG-COMPONENTS-DIGIT-ENTRY-VIEWS-0001",
    "title": "Use secure digit fields",
    "category": "components",
    "topic": "digit-entry-views",
    "subtopic": "best-practices",
    "statement": {
      "en": "Choose or apply secure digit fields in the documented context.",
      "ja": "該当する状況ではsecure digit fieldsを採用する。"
    },
    "normative_level": "SHOULD",
    "confidence": "low",
    "review_required": true,
    "polarity": "recommend",
    "severity": "warning",
    "scope": {
      "portability": "apple-component-specific",
      "platforms": [
        "tvos"
      ],
      "devices": [
        "apple-tv"
      ],
      "components": [
        "digit-entry-views"
      ],
      "modalities": []
    },
    "conditions": [
      "Apply within the platform, component, and section context identified by the source trace."
    ],
    "exceptions": [],
    "rationale": {
      "en": "Applying this guidance supports a consistent and usable Digit entry views experience on the scoped Apple platforms.",
      "ja": "この指針は、対象AppleプラットフォームにおけるDigit entry viewsの一貫性と使いやすさを支えます。"
    },
    "checks": {
      "automated": [],
      "manual": [
        "Does the design satisfy “Choose or apply secure digit fields in the documented context.” in the documented Digit entry views context?"
      ]
    },
    "testability": "manual",
    "anti_patterns": [
      "Ignoring this guidance in a context where the source section applies."
    ],
    "positive_examples": [
      "A design review records how the implementation satisfies this rule and any source-scoped exception."
    ],
    "source": {
      "url": "https://developer.apple.com/design/human-interface-guidelines/digit-entry-views",
      "page_title": "Digit entry views",
      "section_path": [
        "Digit entry views",
        "Best practices"
      ],
      "retrieved_at": "2026-07-21T11:14:48.642Z",
      "source_hash": "900f88b9df396f1b3ba861aacdf9f2332892245f7da9211764a812fc93babcd1",
      "source_sentence_hash": "813e13a93814f91363005ec0fc7cee5e7647d3bb73b35b935d46679d151a7e1c",
      "evidence_paraphrase": "Choose or apply secure digit fields in the documented context."
    },
    "tags": [
      "components",
      "digit-entry-views",
      "best-practices"
    ],
    "priority_rank": 4,
    "status": "active",
    "apple_native_rule": "Choose or apply secure digit fields in the documented context.",
    "portable_interpretation": "Preserve the user-centered intent after replacing Apple-specific platforms, components, and input conventions."
  },
  {
    "id": "HIG-COMPONENTS-DIGIT-ENTRY-VIEWS-0002",
    "title": "Clearly state the purpose of the digit entry view",
    "category": "components",
    "topic": "digit-entry-views",
    "subtopic": "best-practices",
    "statement": {
      "en": "Clearly state the purpose of the digit entry view.",
      "ja": "state the purpose of the digit entry viewを明確にする。"
    },
    "normative_level": "SHOULD",
    "confidence": "low",
    "review_required": true,
    "polarity": "recommend",
    "severity": "warning",
    "scope": {
      "portability": "apple-component-specific",
      "platforms": [
        "tvos"
      ],
      "devices": [
        "apple-tv"
      ],
      "components": [
        "digit-entry-views"
      ],
      "modalities": []
    },
    "conditions": [
      "Apply within the platform, component, and section context identified by the source trace."
    ],
    "exceptions": [],
    "rationale": {
      "en": "Applying this guidance supports a consistent and usable Digit entry views experience on the scoped Apple platforms.",
      "ja": "この指針は、対象AppleプラットフォームにおけるDigit entry viewsの一貫性と使いやすさを支えます。"
    },
    "checks": {
      "automated": [],
      "manual": [
        "Does the design satisfy “Clearly state the purpose of the digit entry view.” in the documented Digit entry views context?"
      ]
    },
    "testability": "manual",
    "anti_patterns": [
      "Ignoring this guidance in a context where the source section applies."
    ],
    "positive_examples": [
      "A design review records how the implementation satisfies this rule and any source-scoped exception."
    ],
    "source": {
      "url": "https://developer.apple.com/design/human-interface-guidelines/digit-entry-views",
      "page_title": "Digit entry views",
      "section_path": [
        "Digit entry views",
        "Best practices"
      ],
      "retrieved_at": "2026-07-21T11:14:48.642Z",
      "source_hash": "900f88b9df396f1b3ba861aacdf9f2332892245f7da9211764a812fc93babcd1",
      "source_sentence_hash": "519e6368c74f1c42ac9a48de95adb4245d811632b633ad471d39fc7b6dc6968e",
      "evidence_paraphrase": "Clearly state the purpose of the digit entry view."
    },
    "tags": [
      "components",
      "digit-entry-views",
      "best-practices"
    ],
    "priority_rank": 4,
    "status": "active",
    "apple_native_rule": "Clearly state the purpose of the digit entry view.",
    "portable_interpretation": "Preserve the user-centered intent after replacing Apple-specific platforms, components, and input conventions."
  }
]
