[
  {
    "id": "HIG-COMPONENTS-STEPPERS-0001",
    "title": "Make the value that a stepper affects obvious",
    "category": "components",
    "topic": "steppers",
    "subtopic": "best-practices",
    "statement": {
      "en": "Apply the documented Steppers guidance to make the value that a stepper affects obvious.",
      "ja": "「Steppers」において「Make the value that a stepper affects obvious」の指針を適用する。"
    },
    "normative_level": "SHOULD",
    "confidence": "low",
    "review_required": true,
    "polarity": "recommend",
    "severity": "warning",
    "scope": {
      "portability": "apple-component-specific",
      "platforms": [
        "ios",
        "ipados",
        "macos",
        "visionos"
      ],
      "devices": [
        "iphone",
        "ipad",
        "mac",
        "apple-vision-pro"
      ],
      "components": [
        "steppers"
      ],
      "modalities": []
    },
    "conditions": [
      "Apply within the platform, component, and section context identified by the source trace."
    ],
    "exceptions": [],
    "rationale": {
      "en": "Applying this guidance supports a consistent and usable Steppers experience on the scoped Apple platforms.",
      "ja": "この指針は、対象AppleプラットフォームにおけるSteppersの一貫性と使いやすさを支えます。"
    },
    "checks": {
      "automated": [],
      "manual": [
        "Does the design satisfy “Apply the documented Steppers guidance to make the value that a stepper affects obvious.” in the documented Steppers context?"
      ]
    },
    "testability": "manual",
    "anti_patterns": [
      "Ignoring this guidance in a context where the source section applies."
    ],
    "positive_examples": [
      "A design review records how the implementation satisfies this rule and any source-scoped exception."
    ],
    "source": {
      "url": "https://developer.apple.com/design/human-interface-guidelines/steppers",
      "page_title": "Steppers",
      "section_path": [
        "Steppers",
        "Best practices"
      ],
      "retrieved_at": "2026-07-21T11:15:23.601Z",
      "source_hash": "735c15a592c519c481d1a9354d103e1dc3cadcda9ed1afd707cf4a0c54054b56",
      "source_sentence_hash": "5c20e52357d0697b69d381e0055db96713e2d948116b6492ff30be90e67a4a70",
      "evidence_paraphrase": "Apply the documented Steppers guidance to make the value that a stepper affects obvious."
    },
    "tags": [
      "components",
      "steppers",
      "best-practices"
    ],
    "priority_rank": 6,
    "status": "active",
    "apple_native_rule": "Apply the documented Steppers guidance to make the value that a stepper affects obvious.",
    "portable_interpretation": "Preserve the user-centered intent after replacing Apple-specific platforms, components, and input conventions."
  },
  {
    "id": "HIG-COMPONENTS-STEPPERS-0002",
    "title": "Consider pairing a stepper with a text field when large value changes are likely",
    "category": "components",
    "topic": "steppers",
    "subtopic": "best-practices",
    "statement": {
      "en": "Evaluate whether pairing a stepper with a text field when large value changes are likely is appropriate for the current context.",
      "ja": "pairing a stepper with a text field when large value changes are likelyが現在の状況に適切か検討する。"
    },
    "normative_level": "MAY",
    "confidence": "low",
    "review_required": true,
    "polarity": "permit",
    "severity": "info",
    "scope": {
      "portability": "apple-component-specific",
      "platforms": [
        "ios",
        "ipados",
        "macos",
        "visionos"
      ],
      "devices": [
        "iphone",
        "ipad",
        "mac",
        "apple-vision-pro"
      ],
      "components": [
        "steppers"
      ],
      "modalities": []
    },
    "conditions": [
      "Apply within the platform, component, and section context identified by the source trace."
    ],
    "exceptions": [],
    "rationale": {
      "en": "Applying this guidance supports a consistent and usable Steppers experience on the scoped Apple platforms.",
      "ja": "この指針は、対象AppleプラットフォームにおけるSteppersの一貫性と使いやすさを支えます。"
    },
    "checks": {
      "automated": [],
      "manual": [
        "Does the design satisfy “Evaluate whether pairing a stepper with a text field when large value changes are likely is appropriate for the current context.” in the documented Steppers context?"
      ]
    },
    "testability": "manual",
    "anti_patterns": [
      "Ignoring this guidance in a context where the source section applies."
    ],
    "positive_examples": [
      "A design review records how the implementation satisfies this rule and any source-scoped exception."
    ],
    "source": {
      "url": "https://developer.apple.com/design/human-interface-guidelines/steppers",
      "page_title": "Steppers",
      "section_path": [
        "Steppers",
        "Best practices"
      ],
      "retrieved_at": "2026-07-21T11:15:23.601Z",
      "source_hash": "735c15a592c519c481d1a9354d103e1dc3cadcda9ed1afd707cf4a0c54054b56",
      "source_sentence_hash": "e3aaa75d0a4e873857f5127aa90dc4edbc08846b133dad236e653fd4a0f3f9be",
      "evidence_paraphrase": "Evaluate whether pairing a stepper with a text field when large value changes are likely is appropriate for the current context."
    },
    "tags": [
      "components",
      "steppers",
      "best-practices"
    ],
    "priority_rank": 6,
    "status": "active",
    "apple_native_rule": "Evaluate whether pairing a stepper with a text field when large value changes are likely is appropriate for the current context.",
    "portable_interpretation": "Preserve the user-centered intent after replacing Apple-specific platforms, components, and input conventions."
  },
  {
    "id": "HIG-COMPONENTS-STEPPERS-0003",
    "title": "For large value ranges, consider supporting Shift-click to change the value quickly",
    "category": "components",
    "topic": "steppers",
    "subtopic": "macos",
    "statement": {
      "en": "When large value ranges, consider supporting Shift-click to change the value quickly.",
      "ja": "large value rangesの場合はsupporting Shift-click to change the value quicklyを検討する。"
    },
    "normative_level": "MAY",
    "confidence": "low",
    "review_required": true,
    "polarity": "permit",
    "severity": "info",
    "scope": {
      "portability": "apple-component-specific",
      "platforms": [
        "macos"
      ],
      "devices": [
        "mac"
      ],
      "components": [
        "steppers"
      ],
      "modalities": []
    },
    "conditions": [
      "Apply within the platform, component, and section context identified by the source trace."
    ],
    "exceptions": [],
    "rationale": {
      "en": "Applying this guidance supports a consistent and usable Steppers experience on the scoped Apple platforms.",
      "ja": "この指針は、対象AppleプラットフォームにおけるSteppersの一貫性と使いやすさを支えます。"
    },
    "checks": {
      "automated": [],
      "manual": [
        "Does the design satisfy “When large value ranges, consider supporting Shift-click to change the value quickly.” in the documented Steppers context?"
      ]
    },
    "testability": "manual",
    "anti_patterns": [
      "Ignoring this guidance in a context where the source section applies."
    ],
    "positive_examples": [
      "A design review records how the implementation satisfies this rule and any source-scoped exception."
    ],
    "source": {
      "url": "https://developer.apple.com/design/human-interface-guidelines/steppers",
      "page_title": "Steppers",
      "section_path": [
        "Steppers",
        "Platform considerations",
        "macOS"
      ],
      "retrieved_at": "2026-07-21T11:15:23.601Z",
      "source_hash": "735c15a592c519c481d1a9354d103e1dc3cadcda9ed1afd707cf4a0c54054b56",
      "source_sentence_hash": "f6b2a9aae7956301faec897918b80c3eaf2b54c18f030340c440688c1568d696",
      "evidence_paraphrase": "When large value ranges, consider supporting Shift-click to change the value quickly."
    },
    "tags": [
      "components",
      "steppers",
      "platform-considerations",
      "macos"
    ],
    "priority_rank": 4,
    "status": "active",
    "apple_native_rule": "When large value ranges, consider supporting Shift-click to change the value quickly.",
    "portable_interpretation": "Preserve the user-centered intent after replacing Apple-specific platforms, components, and input conventions."
  }
]
