[
  {
    "id": "HIG-COMPONENTS-BOXES-0001",
    "title": "Prefer keeping a box relatively small in comparison with its containing view",
    "category": "components",
    "topic": "boxes",
    "subtopic": "best-practices",
    "statement": {
      "en": "Favor keeping a box relatively small in comparison with its containing view when the documented conditions apply.",
      "ja": "該当条件ではkeeping a box relatively small in comparison with its containing viewを優先する。"
    },
    "normative_level": "SHOULD",
    "confidence": "low",
    "review_required": true,
    "polarity": "recommend",
    "severity": "warning",
    "scope": {
      "portability": "apple-component-specific",
      "platforms": [
        "ios",
        "ipados",
        "macos",
        "visionos"
      ],
      "devices": [
        "iphone",
        "ipad",
        "mac",
        "apple-vision-pro"
      ],
      "components": [
        "boxes"
      ],
      "modalities": []
    },
    "conditions": [
      "Apply within the platform, component, and section context identified by the source trace."
    ],
    "exceptions": [],
    "rationale": {
      "en": "Applying this guidance supports a consistent and usable Boxes experience on the scoped Apple platforms.",
      "ja": "この指針は、対象AppleプラットフォームにおけるBoxesの一貫性と使いやすさを支えます。"
    },
    "checks": {
      "automated": [],
      "manual": [
        "Does the design satisfy “Favor keeping a box relatively small in comparison with its containing view when the documented conditions apply.” in the documented Boxes context?"
      ]
    },
    "testability": "manual",
    "anti_patterns": [
      "Ignoring this guidance in a context where the source section applies."
    ],
    "positive_examples": [
      "A design review records how the implementation satisfies this rule and any source-scoped exception."
    ],
    "source": {
      "url": "https://developer.apple.com/design/human-interface-guidelines/boxes",
      "page_title": "Boxes",
      "section_path": [
        "Boxes",
        "Best practices"
      ],
      "retrieved_at": "2026-07-21T09:49:37.201Z",
      "source_hash": "d5cb96312a5be62f486e6f6053fe9c11ab28a24e5d98cfb7b73b2897f3b4eca6",
      "source_sentence_hash": "69652869b332bd59b455e7808918fe74a91f0f4293011f759743fab7ba792125",
      "evidence_paraphrase": "Favor keeping a box relatively small in comparison with its containing view when the documented conditions apply."
    },
    "tags": [
      "components",
      "boxes",
      "best-practices"
    ],
    "priority_rank": 6,
    "status": "active",
    "apple_native_rule": "Favor keeping a box relatively small in comparison with its containing view when the documented conditions apply.",
    "portable_interpretation": "Preserve the user-centered intent after replacing Apple-specific platforms, components, and input conventions."
  },
  {
    "id": "HIG-COMPONENTS-BOXES-0002",
    "title": "Consider using padding and alignment to communicate additional grouping within a box",
    "category": "components",
    "topic": "boxes",
    "subtopic": "best-practices",
    "statement": {
      "en": "Evaluate whether using padding and alignment to communicate additional grouping within a box is appropriate for the current context.",
      "ja": "using padding and alignment to communicate additional grouping within a boxが現在の状況に適切か検討する。"
    },
    "normative_level": "MAY",
    "confidence": "low",
    "review_required": true,
    "polarity": "permit",
    "severity": "info",
    "scope": {
      "portability": "apple-component-specific",
      "platforms": [
        "ios",
        "ipados",
        "macos",
        "visionos"
      ],
      "devices": [
        "iphone",
        "ipad",
        "mac",
        "apple-vision-pro"
      ],
      "components": [
        "boxes"
      ],
      "modalities": []
    },
    "conditions": [
      "Apply within the platform, component, and section context identified by the source trace."
    ],
    "exceptions": [],
    "rationale": {
      "en": "Applying this guidance supports a consistent and usable Boxes experience on the scoped Apple platforms.",
      "ja": "この指針は、対象AppleプラットフォームにおけるBoxesの一貫性と使いやすさを支えます。"
    },
    "checks": {
      "automated": [],
      "manual": [
        "Does the design satisfy “Evaluate whether using padding and alignment to communicate additional grouping within a box is appropriate for the current context.” in the documented Boxes context?"
      ]
    },
    "testability": "manual",
    "anti_patterns": [
      "Ignoring this guidance in a context where the source section applies."
    ],
    "positive_examples": [
      "A design review records how the implementation satisfies this rule and any source-scoped exception."
    ],
    "source": {
      "url": "https://developer.apple.com/design/human-interface-guidelines/boxes",
      "page_title": "Boxes",
      "section_path": [
        "Boxes",
        "Best practices"
      ],
      "retrieved_at": "2026-07-21T09:49:37.201Z",
      "source_hash": "d5cb96312a5be62f486e6f6053fe9c11ab28a24e5d98cfb7b73b2897f3b4eca6",
      "source_sentence_hash": "60e76cd950755ed5a61754958e5fd52ed05cdb3aea9025956a7c06453e938aa9",
      "evidence_paraphrase": "Evaluate whether using padding and alignment to communicate additional grouping within a box is appropriate for the current context."
    },
    "tags": [
      "components",
      "boxes",
      "best-practices"
    ],
    "priority_rank": 6,
    "status": "active",
    "apple_native_rule": "Evaluate whether using padding and alignment to communicate additional grouping within a box is appropriate for the current context.",
    "portable_interpretation": "Preserve the user-centered intent after replacing Apple-specific platforms, components, and input conventions."
  },
  {
    "id": "HIG-COMPONENTS-BOXES-0003",
    "title": "Provide a succinct introductory title if it helps clarify the box’s contents",
    "category": "components",
    "topic": "boxes",
    "subtopic": "content",
    "statement": {
      "en": "Make a succinct introductory title if it helps clarify the box’s contents available when applicable.",
      "ja": "必要な場合にa succinct introductory title if it helps clarify the box’s contentsを利用可能にする。"
    },
    "normative_level": "SHOULD",
    "confidence": "low",
    "review_required": true,
    "polarity": "recommend",
    "severity": "warning",
    "scope": {
      "portability": "apple-component-specific",
      "platforms": [
        "ios",
        "ipados",
        "macos",
        "visionos"
      ],
      "devices": [
        "iphone",
        "ipad",
        "mac",
        "apple-vision-pro"
      ],
      "components": [
        "boxes"
      ],
      "modalities": []
    },
    "conditions": [
      "Apply within the platform, component, and section context identified by the source trace."
    ],
    "exceptions": [],
    "rationale": {
      "en": "Applying this guidance supports a consistent and usable Boxes experience on the scoped Apple platforms.",
      "ja": "この指針は、対象AppleプラットフォームにおけるBoxesの一貫性と使いやすさを支えます。"
    },
    "checks": {
      "automated": [],
      "manual": [
        "Does the design satisfy “Make a succinct introductory title if it helps clarify the box’s contents available when applicable.” in the documented Boxes context?"
      ]
    },
    "testability": "manual",
    "anti_patterns": [
      "Ignoring this guidance in a context where the source section applies."
    ],
    "positive_examples": [
      "A design review records how the implementation satisfies this rule and any source-scoped exception."
    ],
    "source": {
      "url": "https://developer.apple.com/design/human-interface-guidelines/boxes",
      "page_title": "Boxes",
      "section_path": [
        "Boxes",
        "Content"
      ],
      "retrieved_at": "2026-07-21T09:49:37.201Z",
      "source_hash": "d5cb96312a5be62f486e6f6053fe9c11ab28a24e5d98cfb7b73b2897f3b4eca6",
      "source_sentence_hash": "f9332d549a4d2eb8acf9afe2317cb8ea497dfc9e5971bc708d689b22fc10f3bd",
      "evidence_paraphrase": "Make a succinct introductory title if it helps clarify the box’s contents available when applicable."
    },
    "tags": [
      "components",
      "boxes",
      "content"
    ],
    "priority_rank": 6,
    "status": "active",
    "apple_native_rule": "Make a succinct introductory title if it helps clarify the box’s contents available when applicable.",
    "portable_interpretation": "Preserve the user-centered intent after replacing Apple-specific platforms, components, and input conventions."
  }
]
