[
  {
    "id": "HIG-COMPONENTS-STATUS-BARS-0001",
    "title": "Consider hiding the status bar for full-screen media",
    "category": "components",
    "topic": "status-bars",
    "subtopic": "best-practices",
    "statement": {
      "en": "Consider temporarily hiding the status bar for full-screen media.",
      "ja": "full-screen mediaの表示中はstatus barを一時的に隠すことを検討する。"
    },
    "normative_level": "MAY",
    "confidence": "high",
    "review_required": false,
    "polarity": "permit",
    "severity": "info",
    "scope": {
      "portability": "apple-component-specific",
      "platforms": [
        "ios",
        "ipados"
      ],
      "devices": [
        "iphone",
        "ipad"
      ],
      "components": [
        "status-bars"
      ],
      "modalities": []
    },
    "conditions": [
      "Temporary hiding can reduce distraction and make the media experience more immersive."
    ],
    "exceptions": [],
    "rationale": {
      "en": "Applying this guidance supports a consistent and usable Status bars experience on the scoped Apple platforms.",
      "ja": "この指針は、対象AppleプラットフォームにおけるStatus barsの一貫性と使いやすさを支えます。"
    },
    "checks": {
      "automated": [],
      "manual": [
        "Does the design satisfy “Consider temporarily hiding the status bar for full-screen media.” in the documented Status bars context?"
      ]
    },
    "testability": "manual",
    "anti_patterns": [
      "Ignoring this guidance in a context where the source section applies."
    ],
    "positive_examples": [
      "A design review records how the implementation satisfies this rule and any source-scoped exception."
    ],
    "source": {
      "url": "https://developer.apple.com/design/human-interface-guidelines/status-bars",
      "page_title": "Status bars",
      "section_path": [
        "Status bars",
        "Best practices"
      ],
      "retrieved_at": "2026-07-21T11:15:22.731Z",
      "source_hash": "749ff59ad28668650a600157f1fbdcdcf508da523c1f3194137e1fad473fe1fd",
      "source_sentence_hash": "800ac88f7fc3cd543b2dacc29177443eb9d134f75b7e66efd405e92503fce22f",
      "evidence_paraphrase": "Consider temporarily hiding the status bar for full-screen media."
    },
    "tags": [
      "components",
      "status-bars",
      "best-practices"
    ],
    "priority_rank": 4,
    "status": "active",
    "apple_native_rule": "Consider temporarily hiding the status bar for full-screen media.",
    "portable_interpretation": "Preserve the user-centered intent after replacing Apple-specific platforms, components, and input conventions."
  },
  {
    "id": "HIG-COMPONENTS-STATUS-BARS-0002",
    "title": "Avoid permanently hiding the status bar",
    "category": "components",
    "topic": "status-bars",
    "subtopic": "best-practices",
    "statement": {
      "en": "Avoid permanently hiding the iOS or iPadOS status bar.",
      "ja": "iOSまたはiPadOSのstatus barを恒久的に隠さない。"
    },
    "normative_level": "AVOID",
    "confidence": "high",
    "review_required": false,
    "polarity": "discourage",
    "severity": "warning",
    "scope": {
      "portability": "apple-component-specific",
      "platforms": [
        "ios",
        "ipados"
      ],
      "devices": [
        "iphone",
        "ipad"
      ],
      "components": [
        "status-bars"
      ],
      "modalities": []
    },
    "conditions": [
      "Provide a simple, discoverable gesture that restores a temporarily hidden status bar."
    ],
    "exceptions": [],
    "rationale": {
      "en": "Applying this guidance supports a consistent and usable Status bars experience on the scoped Apple platforms.",
      "ja": "この指針は、対象AppleプラットフォームにおけるStatus barsの一貫性と使いやすさを支えます。"
    },
    "checks": {
      "automated": [],
      "manual": [
        "Does the design satisfy “Avoid permanently hiding the iOS or iPadOS status bar.” in the documented Status bars context?"
      ]
    },
    "testability": "manual",
    "anti_patterns": [
      "Ignoring this guidance in a context where the source section applies."
    ],
    "positive_examples": [
      "A design review records how the implementation satisfies this rule and any source-scoped exception."
    ],
    "source": {
      "url": "https://developer.apple.com/design/human-interface-guidelines/status-bars",
      "page_title": "Status bars",
      "section_path": [
        "Status bars",
        "Best practices"
      ],
      "retrieved_at": "2026-07-21T11:15:22.731Z",
      "source_hash": "749ff59ad28668650a600157f1fbdcdcf508da523c1f3194137e1fad473fe1fd",
      "source_sentence_hash": "d4ed00fec25607254d01b5c80df05820a226f6b552592f155b850d04572e998f",
      "evidence_paraphrase": "Avoid permanently hiding the iOS or iPadOS status bar."
    },
    "tags": [
      "components",
      "status-bars",
      "best-practices"
    ],
    "priority_rank": 4,
    "status": "active",
    "apple_native_rule": "Avoid permanently hiding the iOS or iPadOS status bar.",
    "portable_interpretation": "Preserve the user-centered intent after replacing Apple-specific platforms, components, and input conventions."
  }
]
