[
  {
    "id": "HIG-COMPONENTS-WEB-VIEWS-0001",
    "title": "Support forward and back navigation when appropriate",
    "category": "components",
    "topic": "web-views",
    "subtopic": "best-practices",
    "statement": {
      "en": "Ensure the experience accommodates forward and back navigation when appropriate.",
      "ja": "forward and back navigation when appropriateを利用できる設計にする。"
    },
    "normative_level": "SHOULD",
    "confidence": "low",
    "review_required": true,
    "polarity": "recommend",
    "severity": "warning",
    "scope": {
      "portability": "apple-component-specific",
      "platforms": [
        "ios",
        "ipados",
        "macos",
        "visionos"
      ],
      "devices": [
        "iphone",
        "ipad",
        "mac",
        "apple-vision-pro"
      ],
      "components": [
        "web-views"
      ],
      "modalities": []
    },
    "conditions": [
      "Apply within the platform, component, and section context identified by the source trace."
    ],
    "exceptions": [],
    "rationale": {
      "en": "Applying this guidance supports a consistent and usable Web views experience on the scoped Apple platforms.",
      "ja": "この指針は、対象AppleプラットフォームにおけるWeb viewsの一貫性と使いやすさを支えます。"
    },
    "checks": {
      "automated": [],
      "manual": [
        "Does the design satisfy “Ensure the experience accommodates forward and back navigation when appropriate.” in the documented Web views context?"
      ]
    },
    "testability": "manual",
    "anti_patterns": [
      "Ignoring this guidance in a context where the source section applies."
    ],
    "positive_examples": [
      "A design review records how the implementation satisfies this rule and any source-scoped exception."
    ],
    "source": {
      "url": "https://developer.apple.com/design/human-interface-guidelines/web-views",
      "page_title": "Web views",
      "section_path": [
        "Web views",
        "Best practices"
      ],
      "retrieved_at": "2026-07-21T07:08:19.904Z",
      "source_hash": "d6d1c808117ab7d92415e37b5e749596eee845c3be0c2cd94f78fe9c133fcc87",
      "source_sentence_hash": "9d45a37b8a7db4b6c1b2dd14e981d636f2f809f367ec115f20077ab87d5199dc",
      "evidence_paraphrase": "Ensure the experience accommodates forward and back navigation when appropriate."
    },
    "tags": [
      "components",
      "web-views",
      "best-practices"
    ],
    "priority_rank": 6,
    "status": "active",
    "apple_native_rule": "Ensure the experience accommodates forward and back navigation when appropriate.",
    "portable_interpretation": "Preserve the user-centered intent after replacing Apple-specific platforms, components, and input conventions."
  },
  {
    "id": "HIG-COMPONENTS-WEB-VIEWS-0002",
    "title": "Avoid using a web view to build a web browser",
    "category": "components",
    "topic": "web-views",
    "subtopic": "best-practices",
    "statement": {
      "en": "Exclude using a web view to build a web browser from the applicable experience.",
      "ja": "該当する体験ではusing a web view to build a web browserを避ける。"
    },
    "normative_level": "AVOID",
    "confidence": "low",
    "review_required": true,
    "polarity": "discourage",
    "severity": "warning",
    "scope": {
      "portability": "apple-component-specific",
      "platforms": [
        "ios",
        "ipados",
        "macos",
        "visionos"
      ],
      "devices": [
        "iphone",
        "ipad",
        "mac",
        "apple-vision-pro"
      ],
      "components": [
        "web-views"
      ],
      "modalities": []
    },
    "conditions": [
      "Apply within the platform, component, and section context identified by the source trace."
    ],
    "exceptions": [],
    "rationale": {
      "en": "Applying this guidance supports a consistent and usable Web views experience on the scoped Apple platforms.",
      "ja": "この指針は、対象AppleプラットフォームにおけるWeb viewsの一貫性と使いやすさを支えます。"
    },
    "checks": {
      "automated": [],
      "manual": [
        "Does the design satisfy “Exclude using a web view to build a web browser from the applicable experience.” in the documented Web views context?"
      ]
    },
    "testability": "manual",
    "anti_patterns": [
      "Ignoring this guidance in a context where the source section applies."
    ],
    "positive_examples": [
      "A design review records how the implementation satisfies this rule and any source-scoped exception."
    ],
    "source": {
      "url": "https://developer.apple.com/design/human-interface-guidelines/web-views",
      "page_title": "Web views",
      "section_path": [
        "Web views",
        "Best practices"
      ],
      "retrieved_at": "2026-07-21T07:08:19.904Z",
      "source_hash": "d6d1c808117ab7d92415e37b5e749596eee845c3be0c2cd94f78fe9c133fcc87",
      "source_sentence_hash": "512483e26b9f16d2866026c062b91a99d9386d15144e622a342f66091c3e53fa",
      "evidence_paraphrase": "Exclude using a web view to build a web browser from the applicable experience."
    },
    "tags": [
      "components",
      "web-views",
      "best-practices"
    ],
    "priority_rank": 6,
    "status": "active",
    "apple_native_rule": "Exclude using a web view to build a web browser from the applicable experience.",
    "portable_interpretation": "Preserve the user-centered intent after replacing Apple-specific platforms, components, and input conventions."
  }
]
