[
  {
    "id": "HIG-INPUTS-GYRO-AND-ACCELEROMETER-0001",
    "title": "Use motion data only to offer a tangible benefit to people",
    "category": "inputs",
    "topic": "gyro-and-accelerometer",
    "subtopic": "best-practices",
    "statement": {
      "en": "Choose or apply motion data only to offer a tangible benefit to people in the documented context.",
      "ja": "該当する状況ではmotion data only to offer a tangible benefit to peopleを採用する。"
    },
    "normative_level": "SHOULD",
    "confidence": "low",
    "review_required": true,
    "polarity": "recommend",
    "severity": "warning",
    "scope": {
      "portability": "apple-platform",
      "platforms": [
        "ios",
        "ipados",
        "macos",
        "tvos",
        "visionos",
        "watchos"
      ],
      "devices": [
        "iphone",
        "ipad",
        "mac",
        "apple-tv",
        "apple-vision-pro",
        "apple-watch"
      ],
      "components": [],
      "modalities": []
    },
    "conditions": [
      "Apply within the platform, component, and section context identified by the source trace."
    ],
    "exceptions": [],
    "rationale": {
      "en": "Applying this guidance supports a consistent and usable Gyroscope and accelerometer experience on the scoped Apple platforms.",
      "ja": "この指針は、対象AppleプラットフォームにおけるGyroscope and accelerometerの一貫性と使いやすさを支えます。"
    },
    "checks": {
      "automated": [],
      "manual": [
        "Does the design satisfy “Choose or apply motion data only to offer a tangible benefit to people in the documented context.” in the documented Gyroscope and accelerometer context?"
      ]
    },
    "testability": "manual",
    "anti_patterns": [
      "Ignoring this guidance in a context where the source section applies."
    ],
    "positive_examples": [
      "A design review records how the implementation satisfies this rule and any source-scoped exception."
    ],
    "source": {
      "url": "https://developer.apple.com/design/human-interface-guidelines/gyro-and-accelerometer",
      "page_title": "Gyroscope and accelerometer",
      "section_path": [
        "Gyroscope and accelerometer",
        "Best practices"
      ],
      "retrieved_at": "2026-07-21T11:14:54.989Z",
      "source_hash": "f5588f8f6c660bbae353f2429e3357002a479f9ab6de730456a528869acd5151",
      "source_sentence_hash": "aed51266e5f43ae5f4e4d4e1a84a75b91c63502a0c4dc8180c787b0c3bed93ad",
      "evidence_paraphrase": "Choose or apply motion data only to offer a tangible benefit to people in the documented context."
    },
    "tags": [
      "inputs",
      "gyro-and-accelerometer",
      "best-practices"
    ],
    "priority_rank": 5,
    "status": "active",
    "apple_native_rule": "Choose or apply motion data only to offer a tangible benefit to people in the documented context.",
    "portable_interpretation": "Preserve the user-centered intent after replacing Apple-specific platforms, components, and input conventions."
  }
]
