[
  {
    "id": "HIG-COMPONENTS-COLOR-WELLS-0001",
    "title": "Consider the system-provided color picker for a familiar experience",
    "category": "components",
    "topic": "color-wells",
    "subtopic": "best-practices",
    "statement": {
      "en": "Evaluate whether the system-provided color picker for a familiar experience is appropriate for the current context.",
      "ja": "the system-provided color picker for a familiar experienceが現在の状況に適切か検討する。"
    },
    "normative_level": "MAY",
    "confidence": "low",
    "review_required": true,
    "polarity": "permit",
    "severity": "info",
    "scope": {
      "portability": "apple-component-specific",
      "platforms": [
        "ios",
        "ipados",
        "macos",
        "visionos"
      ],
      "devices": [
        "iphone",
        "ipad",
        "mac",
        "apple-vision-pro"
      ],
      "components": [
        "color-wells"
      ],
      "modalities": []
    },
    "conditions": [
      "Apply within the platform, component, and section context identified by the source trace."
    ],
    "exceptions": [],
    "rationale": {
      "en": "Applying this guidance supports a consistent and usable Color wells experience on the scoped Apple platforms.",
      "ja": "この指針は、対象AppleプラットフォームにおけるColor wellsの一貫性と使いやすさを支えます。"
    },
    "checks": {
      "automated": [],
      "manual": [
        "Does the design satisfy “Evaluate whether the system-provided color picker for a familiar experience is appropriate for the current context.” in the documented Color wells context?"
      ]
    },
    "testability": "manual",
    "anti_patterns": [
      "Ignoring this guidance in a context where the source section applies."
    ],
    "positive_examples": [
      "A design review records how the implementation satisfies this rule and any source-scoped exception."
    ],
    "source": {
      "url": "https://developer.apple.com/design/human-interface-guidelines/color-wells",
      "page_title": "Color wells",
      "section_path": [
        "Color wells",
        "Best practices"
      ],
      "retrieved_at": "2026-07-21T07:07:33.873Z",
      "source_hash": "b43f3a9bddddd5290039990c8fc95aec20903d5cd5a20be98d24084cb477ee41",
      "source_sentence_hash": "260942d5506362e9eee5c80068bf52d315d27d7ae326bcbc9c4a9ef39c0c8a9f",
      "evidence_paraphrase": "Evaluate whether the system-provided color picker for a familiar experience is appropriate for the current context."
    },
    "tags": [
      "components",
      "color-wells",
      "best-practices"
    ],
    "priority_rank": 6,
    "status": "active",
    "apple_native_rule": "Evaluate whether the system-provided color picker for a familiar experience is appropriate for the current context.",
    "portable_interpretation": "Preserve the user-centered intent after replacing Apple-specific platforms, components, and input conventions."
  }
]
