[
  {
    "id": "HIG-PATTERNS-LOADING-0001",
    "title": "Show something as soon as possible",
    "category": "patterns",
    "topic": "loading",
    "subtopic": "best-practices",
    "statement": {
      "en": "Present something as soon as possible in the documented context.",
      "ja": "該当する状況でsomething as soon as possibleを表示する。"
    },
    "normative_level": "SHOULD",
    "confidence": "low",
    "review_required": true,
    "polarity": "recommend",
    "severity": "warning",
    "scope": {
      "portability": "apple-platform",
      "platforms": [
        "ios",
        "ipados",
        "macos",
        "tvos",
        "visionos",
        "watchos"
      ],
      "devices": [
        "iphone",
        "ipad",
        "mac",
        "apple-tv",
        "apple-vision-pro",
        "apple-watch"
      ],
      "components": [],
      "modalities": []
    },
    "conditions": [
      "Apply within the platform, component, and section context identified by the source trace."
    ],
    "exceptions": [],
    "rationale": {
      "en": "Applying this guidance supports a consistent and usable Loading experience on the scoped Apple platforms.",
      "ja": "この指針は、対象AppleプラットフォームにおけるLoadingの一貫性と使いやすさを支えます。"
    },
    "checks": {
      "automated": [],
      "manual": [
        "Does the design satisfy “Present something as soon as possible in the documented context.” in the documented Loading context?"
      ]
    },
    "testability": "manual",
    "anti_patterns": [
      "Ignoring this guidance in a context where the source section applies."
    ],
    "positive_examples": [
      "A design review records how the implementation satisfies this rule and any source-scoped exception."
    ],
    "source": {
      "url": "https://developer.apple.com/design/human-interface-guidelines/loading",
      "page_title": "Loading",
      "section_path": [
        "Loading",
        "Best practices"
      ],
      "retrieved_at": "2026-07-21T07:07:53.989Z",
      "source_hash": "1dca25a893f01c57e059c8d3ba0a595d5e855814ce7d3ade6a1857e7e8a1e895",
      "source_sentence_hash": "138f3c448e8006e254f1d84d16daba58249c2b22a1646dd41f4928c336a170dc",
      "evidence_paraphrase": "Present something as soon as possible in the documented context."
    },
    "tags": [
      "patterns",
      "loading",
      "best-practices"
    ],
    "priority_rank": 6,
    "status": "active",
    "apple_native_rule": "Present something as soon as possible in the documented context.",
    "portable_interpretation": "Preserve the user-centered intent after replacing Apple-specific platforms, components, and input conventions."
  },
  {
    "id": "HIG-PATTERNS-LOADING-0002",
    "title": "Let people do other things in your app or game while they wait for content to load",
    "category": "patterns",
    "topic": "loading",
    "subtopic": "best-practices",
    "statement": {
      "en": "Preserve people’s ability to do other things in your app or game while they wait for content to load.",
      "ja": "利用者がdo other things in your app or game while they wait for content to loadできる状態を保つ。"
    },
    "normative_level": "SHOULD",
    "confidence": "low",
    "review_required": true,
    "polarity": "recommend",
    "severity": "warning",
    "scope": {
      "portability": "apple-platform",
      "platforms": [
        "ios",
        "ipados",
        "macos",
        "tvos",
        "visionos",
        "watchos"
      ],
      "devices": [
        "iphone",
        "ipad",
        "mac",
        "apple-tv",
        "apple-vision-pro",
        "apple-watch"
      ],
      "components": [],
      "modalities": []
    },
    "conditions": [
      "Apply within the platform, component, and section context identified by the source trace."
    ],
    "exceptions": [],
    "rationale": {
      "en": "Applying this guidance supports a consistent and usable Loading experience on the scoped Apple platforms.",
      "ja": "この指針は、対象AppleプラットフォームにおけるLoadingの一貫性と使いやすさを支えます。"
    },
    "checks": {
      "automated": [],
      "manual": [
        "Does the design satisfy “Preserve people’s ability to do other things in your app or game while they wait for content to load.” in the documented Loading context?"
      ]
    },
    "testability": "manual",
    "anti_patterns": [
      "Ignoring this guidance in a context where the source section applies."
    ],
    "positive_examples": [
      "A design review records how the implementation satisfies this rule and any source-scoped exception."
    ],
    "source": {
      "url": "https://developer.apple.com/design/human-interface-guidelines/loading",
      "page_title": "Loading",
      "section_path": [
        "Loading",
        "Best practices"
      ],
      "retrieved_at": "2026-07-21T07:07:53.989Z",
      "source_hash": "1dca25a893f01c57e059c8d3ba0a595d5e855814ce7d3ade6a1857e7e8a1e895",
      "source_sentence_hash": "f027c490910d93a64b9112f93f7b2c74903f2b5953ff2e485cc376b8f1e92529",
      "evidence_paraphrase": "Preserve people’s ability to do other things in your app or game while they wait for content to load."
    },
    "tags": [
      "patterns",
      "loading",
      "best-practices"
    ],
    "priority_rank": 6,
    "status": "active",
    "apple_native_rule": "Preserve people’s ability to do other things in your app or game while they wait for content to load.",
    "portable_interpretation": "Preserve the user-centered intent after replacing Apple-specific platforms, components, and input conventions."
  }
]
