[
  {
    "id": "HIG-COMPONENTS-LOCKUPS-0001",
    "title": "Allow adequate space between lockups",
    "category": "components",
    "topic": "lockups",
    "subtopic": "best-practices",
    "statement": {
      "en": "Apply the documented Lockups guidance to allow adequate space between lockups.",
      "ja": "「Lockups」において「Allow adequate space between lockups」の指針を適用する。"
    },
    "normative_level": "SHOULD",
    "confidence": "low",
    "review_required": true,
    "polarity": "recommend",
    "severity": "warning",
    "scope": {
      "portability": "apple-component-specific",
      "platforms": [
        "tvos"
      ],
      "devices": [
        "apple-tv"
      ],
      "components": [
        "lockups"
      ],
      "modalities": []
    },
    "conditions": [
      "Apply within the platform, component, and section context identified by the source trace."
    ],
    "exceptions": [],
    "rationale": {
      "en": "Applying this guidance supports a consistent and usable Lockups experience on the scoped Apple platforms.",
      "ja": "この指針は、対象AppleプラットフォームにおけるLockupsの一貫性と使いやすさを支えます。"
    },
    "checks": {
      "automated": [],
      "manual": [
        "Does the design satisfy “Apply the documented Lockups guidance to allow adequate space between lockups.” in the documented Lockups context?"
      ]
    },
    "testability": "manual",
    "anti_patterns": [
      "Ignoring this guidance in a context where the source section applies."
    ],
    "positive_examples": [
      "A design review records how the implementation satisfies this rule and any source-scoped exception."
    ],
    "source": {
      "url": "https://developer.apple.com/design/human-interface-guidelines/lockups",
      "page_title": "Lockups",
      "section_path": [
        "Lockups",
        "Best practices"
      ],
      "retrieved_at": "2026-07-21T11:15:03.088Z",
      "source_hash": "2df6b331ac1632eac32a08662c2fe7de73a8ce930130082fd9fa89a4dafbb95f",
      "source_sentence_hash": "08c22973df7499d32f329f231519349429f1d2d63d4e5a6999762376ef01f749",
      "evidence_paraphrase": "Apply the documented Lockups guidance to allow adequate space between lockups."
    },
    "tags": [
      "components",
      "lockups",
      "best-practices"
    ],
    "priority_rank": 4,
    "status": "active",
    "apple_native_rule": "Apply the documented Lockups guidance to allow adequate space between lockups.",
    "portable_interpretation": "Preserve the user-centered intent after replacing Apple-specific platforms, components, and input conventions."
  },
  {
    "id": "HIG-COMPONENTS-LOCKUPS-0002",
    "title": "Use consistent lockup sizes within a row or group",
    "category": "components",
    "topic": "lockups",
    "subtopic": "best-practices",
    "statement": {
      "en": "Choose or apply consistent lockup sizes within a row or group in the documented context.",
      "ja": "該当する状況ではconsistent lockup sizes within a row or groupを採用する。"
    },
    "normative_level": "SHOULD",
    "confidence": "low",
    "review_required": true,
    "polarity": "recommend",
    "severity": "warning",
    "scope": {
      "portability": "apple-component-specific",
      "platforms": [
        "tvos"
      ],
      "devices": [
        "apple-tv"
      ],
      "components": [
        "lockups"
      ],
      "modalities": []
    },
    "conditions": [
      "Apply within the platform, component, and section context identified by the source trace."
    ],
    "exceptions": [],
    "rationale": {
      "en": "Applying this guidance supports a consistent and usable Lockups experience on the scoped Apple platforms.",
      "ja": "この指針は、対象AppleプラットフォームにおけるLockupsの一貫性と使いやすさを支えます。"
    },
    "checks": {
      "automated": [],
      "manual": [
        "Does the design satisfy “Choose or apply consistent lockup sizes within a row or group in the documented context.” in the documented Lockups context?"
      ]
    },
    "testability": "manual",
    "anti_patterns": [
      "Ignoring this guidance in a context where the source section applies."
    ],
    "positive_examples": [
      "A design review records how the implementation satisfies this rule and any source-scoped exception."
    ],
    "source": {
      "url": "https://developer.apple.com/design/human-interface-guidelines/lockups",
      "page_title": "Lockups",
      "section_path": [
        "Lockups",
        "Best practices"
      ],
      "retrieved_at": "2026-07-21T11:15:03.088Z",
      "source_hash": "2df6b331ac1632eac32a08662c2fe7de73a8ce930130082fd9fa89a4dafbb95f",
      "source_sentence_hash": "7a9bb7149e84168a8a42fa72e1180cd6dfc228af0b7ed6452cd66f0f68446c29",
      "evidence_paraphrase": "Choose or apply consistent lockup sizes within a row or group in the documented context."
    },
    "tags": [
      "components",
      "lockups",
      "best-practices"
    ],
    "priority_rank": 4,
    "status": "active",
    "apple_native_rule": "Choose or apply consistent lockup sizes within a row or group in the documented context.",
    "portable_interpretation": "Preserve the user-centered intent after replacing Apple-specific platforms, components, and input conventions."
  },
  {
    "id": "HIG-COMPONENTS-LOCKUPS-0003",
    "title": "Prefer images over initials",
    "category": "components",
    "topic": "lockups",
    "subtopic": "monograms",
    "statement": {
      "en": "Favor images over initials when the documented conditions apply.",
      "ja": "該当条件ではimages over initialsを優先する。"
    },
    "normative_level": "SHOULD",
    "confidence": "low",
    "review_required": true,
    "polarity": "recommend",
    "severity": "warning",
    "scope": {
      "portability": "apple-component-specific",
      "platforms": [
        "tvos"
      ],
      "devices": [
        "apple-tv"
      ],
      "components": [
        "lockups"
      ],
      "modalities": []
    },
    "conditions": [
      "Apply within the platform, component, and section context identified by the source trace."
    ],
    "exceptions": [],
    "rationale": {
      "en": "Applying this guidance supports a consistent and usable Lockups experience on the scoped Apple platforms.",
      "ja": "この指針は、対象AppleプラットフォームにおけるLockupsの一貫性と使いやすさを支えます。"
    },
    "checks": {
      "automated": [],
      "manual": [
        "Does the design satisfy “Favor images over initials when the documented conditions apply.” in the documented Lockups context?"
      ]
    },
    "testability": "manual",
    "anti_patterns": [
      "Ignoring this guidance in a context where the source section applies."
    ],
    "positive_examples": [
      "A design review records how the implementation satisfies this rule and any source-scoped exception."
    ],
    "source": {
      "url": "https://developer.apple.com/design/human-interface-guidelines/lockups",
      "page_title": "Lockups",
      "section_path": [
        "Lockups",
        "Monograms"
      ],
      "retrieved_at": "2026-07-21T11:15:03.088Z",
      "source_hash": "2df6b331ac1632eac32a08662c2fe7de73a8ce930130082fd9fa89a4dafbb95f",
      "source_sentence_hash": "b211121279f47888c697988da8ae3d6c54f10e02e90044799d46e0558c69bc78",
      "evidence_paraphrase": "Favor images over initials when the documented conditions apply."
    },
    "tags": [
      "components",
      "lockups",
      "monograms"
    ],
    "priority_rank": 4,
    "status": "active",
    "apple_native_rule": "Favor images over initials when the documented conditions apply.",
    "portable_interpretation": "Preserve the user-centered intent after replacing Apple-specific platforms, components, and input conventions."
  }
]
